{
  "$schema": "./arcnet-spatial-architecture.schema.json",
  "spatialArchitectureId": "arcnet-spatial-architecture",
  "schemaVersion": "0.2.0",
  "status": "implementation-candidate",
  "extendsFrameId": "arcnet-coordinate-frame",
  "unit": "unitless",
  "authorityEffect": "none",
  "coordinateFamilies": [
    {
      "id": "flower-lattice-2d",
      "dimension": 2,
      "role": "first-class-coordinate-family",
      "canonicalAddressType": "integer-axial-pair",
      "mutableByOrientation": false,
      "authorityEffect": "none"
    },
    {
      "id": "stellar-frame-3d",
      "dimension": 3,
      "role": "inherited-certified-v0.1",
      "sourceRef": "docs/specs/geometry/arcnet-coordinate-frame.md",
      "mutableByOrientation": false,
      "authorityEffect": "none"
    }
  ],
  "flowerLattice": {
    "basis": {
      "bQ": {
        "exact": ["1", "0"],
        "decimal": [1.0, 0.0]
      },
      "bR": {
        "exact": ["1/2", "sqrt(3)/2"],
        "decimal": [0.5, 0.8660254037844386]
      }
    },
    "originAddress": [0, 0],
    "neighborOffsets": [
      [1, 0],
      [-1, 0],
      [0, 1],
      [0, -1],
      [1, -1],
      [-1, 1]
    ],
    "circleRadius": 1,
    "nearestNeighborSpacing": 1,
    "shellDistanceFormula": "max(abs(q),abs(r),abs(q+r))",
    "shellCountFormula": "6*n for n>0",
    "windowCountFormula": "1+3*n*(n+1)",
    "finiteWindows": [
      {
        "id": "seed-7",
        "maxShell": 1,
        "cumulativeCount": 7,
        "addressRule": "d(q,r)<=1"
      },
      {
        "id": "flower-19",
        "maxShell": 2,
        "cumulativeCount": 19,
        "addressRule": "d(q,r)<=2"
      }
    ],
    "initialWindowCounts": [1, 7, 19, 37],
    "nineEmanationCardinalityClaim": false
  },
  "transforms": {
    "planarLift": {
      "id": "flower-planar-lift",
      "fromFamily": "flower-lattice-2d",
      "toFamily": "stellar-frame-3d",
      "kind": "embedding",
      "formula": "L(x,y)=(x,y,0)",
      "exact": true,
      "preservesPlanarDistance": true
    },
    "strongerFlowerStellarRelation": {
      "status": "research",
      "ratified": false,
      "identityClaim": false,
      "requireDerivation": true,
      "requireMachineFalsification": true
    }
  },
  "orientationFrames": {
    "bounded": true,
    "universalSemanticNorth": false,
    "canonicalAddressMutationAllowed": false,
    "northKinds": [
      "semantic-root",
      "geographic",
      "device",
      "astronomical",
      "scene",
      "custom-registered"
    ],
    "referenceRootExamples": [
      "Arcanum-facing",
      "Architect-facing",
      "AERARIUM-facing",
      "registered-context"
    ],
    "requiredFields": [
      "orientationFrameId",
      "version",
      "coordinateFamilyId",
      "referenceRootId",
      "northReference.kind",
      "northReference.sourceRef",
      "northReference.localDirection",
      "handedness",
      "positiveRotationConvention",
      "transformFromCanonical",
      "authorityEffect"
    ],
    "authorityEffect": "none"
  },
  "correspondenceProfiles": {
    "sourceOwned": true,
    "domainScoped": true,
    "coordinatesSelfAuthenticateMeaning": false,
    "sourceKinds": [
      "canonical",
      "historical",
      "tradition",
      "practitioner",
      "research",
      "domain-owned"
    ],
    "targetKinds": [
      "coordinate",
      "direction",
      "root",
      "shell",
      "finite-window",
      "region",
      "edge-class",
      "transform-defined-location"
    ],
    "requiredFields": [
      "profileId",
      "version",
      "domainScope",
      "compatibleCoordinateFamilies",
      "compatibleOrientationFrames",
      "sourceKind",
      "sourceRef",
      "provenance",
      "status",
      "mappings",
      "authorityEffect"
    ],
    "domainLanguagePolicy": {
      "arcanum": "richer-symbolic-language-permitted-with-explicit-provenance",
      "aerarium": "practical-financial-language-with-bounded-poetic-linkage"
    },
    "authorityEffect": "none"
  },
  "geometryFreeEquivalent": {
    "required": true,
    "operationalStatePreserved": true,
    "authorityMeaningPreserved": true,
    "requiredFields": [
      "coordinate-family-id-version",
      "canonical-address",
      "derived-shell-or-finite-window",
      "orientation-frame-id",
      "reference-root",
      "north-reference-kind",
      "correspondence-profile-id",
      "correspondence-status",
      "source-provenance",
      "source-owned-labels",
      "selected-focus",
      "active-transform",
      "logical-topology-state",
      "topology-mapping-status"
    ]
  },
  "topology": {
    "graphTypes": [
      "semantic-correspondence",
      "execution",
      "physical"
    ],
    "logicalFlowerTopology": {
      "preferredResearchHypothesis": true,
      "vertexType": "registered-flower-lattice-address",
      "adjacency": "six-neighbor",
      "createsExecutionPath": false,
      "createsPhysicalEdge": false
    },
    "mappingPipeline": [
      "logical-arcnet-geometry",
      "placement-routing-compiler",
      "hardware-specific-topology-adapter",
      "measured-mapping-result"
    ],
    "adapterCanInventPhysicalConnectivity": false,
    "absentPhysicalLogicalEdgePolicy": "route-or-report-unmapped"
  },
  "hardwareHypothesis": {
    "flowerDerivedPreferredResearchHypothesis": true,
    "physicalOptimalityClaim": false,
    "requiresEmpiricalEvidence": true,
    "requiresSeparateRatification": true,
    "manufacturingMandate": false,
    "comparisonClasses": [
      "square-grid",
      "heavy-hex",
      "generic-mesh",
      "switched-all-to-all",
      "reconfigurable-topology",
      "hardware-specific-coupling-graph"
    ]
  },
  "quantumTerminology": {
    "entanglementReservedForActualQuantumStateRelationships": true,
    "classicalTerms": [
      "edge",
      "link",
      "adjacency",
      "relationship",
      "route",
      "capability-path",
      "mapping"
    ],
    "ceW01QuantumHardwareDependency": false
  },
  "forbiddenEffects": [
    "identity",
    "identity-classification",
    "capability",
    "permission",
    "authority",
    "governance-weight",
    "recognition",
    "recognition-state",
    "readiness",
    "worth",
    "score",
    "economic-entitlement",
    "protocol-finality"
  ],
  "inheritedFalsificationIds": [
    "F1", "F2", "F3", "F4", "F5",
    "F6", "F7", "F8", "F9", "F10"
  ],
  "falsificationIds": [
    "F11", "F12", "F13", "F14", "F15",
    "F16", "F17", "F18", "F19", "F20"
  ]
}
